{
  "id": "google-deepmind",
  "name": "Google DeepMind",
  "aliases": [
    "DeepMind",
    "Google DeepMind"
  ],
  "hq_country": "GB",
  "hq_city": "London",
  "hq_lat": 51.5074,
  "hq_lng": -0.1278,
  "official_domains": [
    "deepmind.google",
    "blog.google"
  ],
  "founded": "2010",
  "profile": {
    "overview": {
      "text": "Google DeepMind is Google's unified AI research and product lab, formed in April 2023 by merging DeepMind -- a London AI lab founded in 2010 by Demis Hassabis, Shane Legg and Mustafa Suleyman and acquired by Google in 2014 -- with Google's own Google Brain team, under Hassabis as CEO.",
      "citations": [
        {
          "url": "https://deepmind.google/about/",
          "outlet": "Google DeepMind (official)",
          "quote": "Build AI responsibly to benefit humanity"
        }
      ]
    },
    "what_theyve_done": [
      {
        "text": "DeepMind was founded in the UK in 2010 and built early deep-reinforcement-learning systems including AlphaGo, while Google Brain, started in 2011, invented the Transformer architecture underlying most modern large language models.",
        "citations": [
          {
            "url": "https://deepmind.google/about/",
            "outlet": "Google DeepMind (official)",
            "quote": "Google DeepMind brings together two of the world's leading AI labs"
          }
        ]
      },
      {
        "text": "Google merged DeepMind and Google Brain into a single organization, Google DeepMind, in April 2023 to consolidate its AI research after the rise of ChatGPT.",
        "citations": [
          {
            "url": "https://en.wikipedia.org/wiki/Google_DeepMind",
            "outlet": "Wikipedia",
            "quote": "in response to OpenAI's ChatGPT"
          }
        ]
      },
      {
        "text": "In May 2026 it released Gemini 3.5 Flash, the first model in a new 3.5 family built for agentic and coding workloads, shipping at once across the free Gemini app, Search's AI Mode, the Gemini API, the new Antigravity developer platform and Gemini Enterprise.",
        "citations": [
          {
            "url": "https://blog.google/innovation-and-ai/models-and-research/gemini-models/gemini-3-5/",
            "outlet": "Google (official blog)",
            "quote": "outperforming Gemini 3.1 Pro on challenging coding and agentic benchmarks"
          }
        ]
      },
      {
        "text": "On July 21, 2026 it released Gemini 3.6 Flash, taking over as its main workhorse tier from 3.5 Flash, alongside a cheaper Gemini 3.5 Flash-Lite and a Gemini 3.5 Flash Cyber restricted to governments and trusted partners. Gemini 3.6 Flash handles text, image, audio, and video input on a 1-million-token context window with 64,000-token max output.",
        "citations": [
          {
            "url": "https://deepmind.google/models/gemini/flash/",
            "outlet": "Google DeepMind (official)",
            "quote": "Best for token efficiency in coding, knowledge work, and multimodal tasks"
          }
        ]
      }
    ],
    "strengths": [
      {
        "text": "Google DeepMind combines two of the field's longest-running research groups -- one that pioneered deep reinforcement learning, one that invented the Transformer -- under a single research and product organization.",
        "citations": [
          {
            "url": "https://deepmind.google/about/",
            "outlet": "Google DeepMind (official)",
            "quote": "world-class talent"
          }
        ]
      },
      {
        "text": "Its Gemini 3.5 Flash release runs roughly four times faster on output tokens per second than prior frontier models by Google's own benchmark comparison, while also beating its own Gemini 3.1 Pro on coding and agentic tasks.",
        "citations": [
          {
            "url": "https://blog.google/innovation-and-ai/models-and-research/gemini-models/gemini-3-5/",
            "outlet": "Google (official blog)",
            "quote": "4 times faster than other frontier models"
          }
        ]
      }
    ],
    "current_focus": {
      "text": "Google DeepMind's current public focus is Gemini 3.6 Flash, which took over the main workhorse role from 3.5 Flash on July 21, 2026, oriented toward agentic workflows and coding rather than general chat and distributed broadly through Google's consumer and developer surfaces at once. A larger Gemini 3.5 Pro sibling remains in partner testing with no announced release date.",
      "citations": [
        {
          "url": "https://deepmind.google/models/gemini/flash/",
          "outlet": "Google DeepMind (official)",
          "quote": "Our workhorse model that reduces output token usage by 17% compared to 3.5 Flash"
        }
      ]
    },
    "roadmap": [
      {
        "text": "As of July 21, 2026, Google says Gemini 3.5 Pro is still in partner testing with no announced release date, walking back its own earlier one-month estimate.",
        "citations": [
          {
            "url": "https://blog.google/innovation-and-ai/models-and-research/gemini-models/gemini-3-6-flash-3-5-flash-lite-3-5-flash-cyber/",
            "outlet": "Google (official blog)",
            "quote": "currently testing with partners and we plan to make it broadly available"
          }
        ]
      },
      {
        "text": "Google says it has started its most ambitious pre-training run yet, for Gemini 4.",
        "citations": [
          {
            "url": "https://blog.google/innovation-and-ai/models-and-research/gemini-models/gemini-3-6-flash-3-5-flash-lite-3-5-flash-cyber/",
            "outlet": "Google (official blog)",
            "quote": "started our most ambitious pre-training run yet, for Gemini 4"
          }
        ]
      }
    ]
  },
  "status": "confirmed",
  "generated_at": "2026-07-13T00:00:00Z",
  "model": "claude-sonnet-5",
  "last_verified": "2026-07-25"
}
