{
  "id": "meta-ai",
  "name": "Meta AI",
  "aliases": [
    "Meta",
    "Meta Superintelligence Labs",
    "Meta Platforms"
  ],
  "hq_country": "US",
  "hq_city": "Menlo Park",
  "hq_lat": 37.4529,
  "hq_lng": -122.1817,
  "official_domains": [
    "ai.meta.com",
    "about.fb.com",
    "meta.com"
  ],
  "founded": "2013",
  "profile": {
    "overview": {
      "text": "Meta's AI research effort traces back to Facebook AI Research (FAIR), founded in December 2013 with Yann LeCun as its first director. In June 2025 Meta consolidated its AI work into a new unit, Meta Superintelligence Labs, headquartered in Menlo Park, California, under chief AI officer Alexandr Wang.",
      "citations": [
        {
          "url": "https://en.wikipedia.org/wiki/Meta_Superintelligence_Labs",
          "outlet": "Wikipedia",
          "quote": "research and development in the field of artificial superintelligence"
        }
      ]
    },
    "what_theyve_done": [
      {
        "text": "Facebook founded FAIR in 2013 to build out an internal AI research division, directed by Yann LeCun until 2018.",
        "citations": [
          {
            "url": "https://en.wikipedia.org/wiki/Meta_AI",
            "outlet": "Wikipedia",
            "quote": "Meta AI was founded in 2013 as Facebook Artificial Intelligence Research (FAIR)"
          }
        ]
      },
      {
        "text": "Meta formed Meta Superintelligence Labs in June 2025, consolidating FAIR and a new TBD Lab team under Alexandr Wang as chief AI officer, following reports that CEO Mark Zuckerberg was unhappy with the April 2025 Llama 4 release.",
        "citations": [
          {
            "url": "https://en.wikipedia.org/wiki/Meta_Superintelligence_Labs",
            "outlet": "Wikipedia",
            "quote": "expressed displeasure at Llama 4, the company's large language model"
          }
        ]
      },
      {
        "text": "In April 2026 the new lab shipped its first model, Muse Spark, built to reason over text, images and live camera or video input, rolling out mainly through Meta's own consumer apps rather than a broad developer API.",
        "citations": [
          {
            "url": "https://about.fb.com/news/2026/04/introducing-muse-spark-meta-superintelligence-labs/",
            "outlet": "Meta (official newsroom)",
            "quote": "our most powerful model yet"
          }
        ]
      },
      {
        "text": "It followed up on July 9, 2026 with Muse Spark 1.1, opening a public-preview Meta Model API for developers for the first time and giving the model a working context of 1 million tokens. Meta priced API access at $1.25 per million input tokens and $4.25 per million output tokens, positioning the agentic-coding-focused model as a low-cost alternative to rivals from OpenAI and Anthropic.",
        "citations": [
          {
            "url": "https://ai.meta.com/blog/introducing-muse-spark-meta-model-api/",
            "outlet": "Meta (official)",
            "quote": "now in public preview"
          },
          {
            "url": "https://techcrunch.com/2026/07/09/meta-enters-the-crowded-ai-coding-battle-with-muse-spark-1-1/",
            "outlet": "TechCrunch",
            "quote": "$1.25 per million input tokens and $4.25 per million output tokens"
          }
        ]
      },
      {
        "text": "On July 7, 2026 it released Muse Image, its first image-generation model -- text-to-image, image-to-image, and editing -- launching in the Meta AI app with expansion to Facebook, Messenger, Instagram, and WhatsApp planned. A related Muse Video model was previewed alongside it but remains in development, not yet released.",
        "citations": [
          {
            "url": "https://about.fb.com/news/2026/07/introducing-muse-image-meta-ai/",
            "outlet": "Meta (official newsroom)",
            "quote": "the creative partner that knows your world"
          }
        ]
      },
      {
        "text": "On July 21, 2026 Meta detailed how two of its open-source vision models, Segment Anything Model 3 (SAM 3) and DINOv3, are being used in the U.S. Department of Energy's Genesis Mission: a multi-lab project called SYNAPS-I fine-tuned both models on scientific imaging data and ran them across roughly 300 GPUs at Lawrence Berkeley National Laboratory's Advanced Light Source, cutting a beamline image-analysis workflow from about a month to roughly 15 minutes.",
        "citations": [
          {
            "url": "https://ai.meta.com/blog/genesis-mission-lawrence-berkeley-national-laboratory-segment-anything-dino/",
            "outlet": "Meta (official)",
            "quote": "The SYNAPS-I team fine-tuned both models on scientific imaging data collected at DOE beamlines."
          }
        ]
      },
      {
        "text": "On July 24, 2026 Meta gave the Meta AI app agentic capabilities built on Muse Spark 1.1: it can now plan and follow through on multi-step tasks, such as scheduling or pulling together research, without step-by-step prompting. The feature began rolling out in the Meta AI app and on meta.ai, with WhatsApp and additional countries to follow.",
        "citations": [
          {
            "url": "https://about.fb.com/news/2026/07/meta-ai-muse-spark-doesnt-just-think-it-acts/",
            "outlet": "Meta (official newsroom)",
            "quote": "Meta AI can now make plans, work with your apps, and follow through"
          }
        ]
      }
    ],
    "strengths": [
      {
        "text": "Muse Spark is built to power Meta's own consumer AI products at scale -- the Meta AI app, WhatsApp, Instagram, Facebook, Messenger and Ray-Ban Meta glasses -- rather than as a general developer-facing API model.",
        "citations": [
          {
            "url": "https://about.fb.com/news/2026/04/introducing-muse-spark-meta-superintelligence-labs/",
            "outlet": "Meta (official newsroom)",
            "quote": "purpose-built for Meta's products"
          }
        ]
      }
    ],
    "current_focus": {
      "text": "Meta Superintelligence Labs' current focus is the Muse Spark line, which Meta describes as a deliberate, scientific step in model scaling where each generation is validated before a bigger one is built. With Muse Spark 1.1 the lab opened a public-preview developer API for the first time, alongside the model's continued rollout through Meta's own consumer apps, while larger successor models are developed in private. That consumer rollout now extends to giving the Meta AI app agentic behavior -- planning and following through on multi-step tasks on a user's behalf -- starting in the Meta AI app and on meta.ai, with WhatsApp and more countries to follow.",
      "citations": [
        {
          "url": "https://about.fb.com/news/2026/04/introducing-muse-spark-meta-superintelligence-labs/",
          "outlet": "Meta (official newsroom)",
          "quote": "a deliberate and scientific approach to model scaling"
        },
        {
          "url": "https://ai.meta.com/blog/introducing-muse-spark-meta-model-api/",
          "outlet": "Meta (official)",
          "quote": "Developers can begin building with Muse Spark 1.1"
        },
        {
          "url": "https://about.fb.com/news/2026/07/meta-ai-muse-spark-doesnt-just-think-it-acts/",
          "outlet": "Meta (official newsroom)",
          "quote": "Meta AI can now give you a daily briefing, pulling what's on your calendar"
        }
      ]
    },
    "roadmap": [
      {
        "text": "Meta says it has larger models already in development beyond Muse Spark and hopes to open-source future versions of the model line, even though Spark itself remains proprietary.",
        "citations": [
          {
            "url": "https://about.fb.com/news/2026/04/introducing-muse-spark-meta-superintelligence-labs/",
            "outlet": "Meta (official newsroom)",
            "quote": "hope to open-source future versions of the model"
          }
        ]
      },
      {
        "text": "Meta says its longer-term goal is what it calls personal superintelligence -- AI that understands a user's world, not just answers questions.",
        "citations": [
          {
            "url": "https://about.fb.com/news/2026/04/introducing-muse-spark-meta-superintelligence-labs/",
            "outlet": "Meta (official newsroom)",
            "quote": "truly understands your world"
          }
        ]
      }
    ]
  },
  "status": "confirmed",
  "generated_at": "2026-07-26T01:45:00Z",
  "model": "claude-sonnet-5",
  "last_verified": "2026-07-26"
}
